{
  "$schema": "../../../../schemas/genre.schema.json",
  "id": "rpg",
  "label": "ロールプレイングゲーム",
  "thresholds": { "growth": 8 },
  "enableFeatures": ["hp", "exp", "item_pickup", "slow_precise"],
  "disableFeatures": ["auto_run", "beat_hazard"],
  "scoreFormula": "exp * 2 + kills * 60 + distance * 0.3",
  "manualReveal": "これはRPGになりました。成長することが目的です。",
  "theme": "rpg",
  "bgColor": "#1a1200",
  "environment": "dungeon",
  "controls": {
    "jump": "Space",
    "moveLeft": "ArrowLeft",
    "moveRight": "ArrowRight",
    "moveUp": "ArrowUp",
    "moveDown": "ArrowDown"
  },
  "gravity": 1600,
  "endingFlavor": "あなたは強くなった。説明書もいつしか経典になっていた。"
}
