{
  "$schema": "../../../../schemas/genre.schema.json",
  "id": "rhythm",
  "label": "リズムゲーム（プロセカ風）",
  "thresholds": { "tempo": 6, "rhythm": 6 },
  "enableFeatures": ["beat_hazard", "just_input"],
  "disableFeatures": ["grid_stop", "double_jump"],
  "scoreFormula": "perfectCount * 320 + greatCount * 280 + niceCount * 150 + combo * 10 + distance * 0.2",
  "manualReveal": "これはリズムゲームになりました。ノートをタイミングよく叩いてください。",
  "theme": "rhythm",
  "bgColor": "#0a0015",
  "controls": {
    "jump": "Space",
    "shoot": "Z"
  },
  "gravity": 0,
  "endingFlavor": "あなたはリズムを刻んだ。説明書のページをめくる音さえも拍子になった。"
}
