{
  "$schema": "../../../schemas/genre.schema.json",
  "id": "dungeon",
  "label": "ダンジョン探索",
  "thresholds": { "growth": 5, "craft": 5 },
  "enableFeatures": ["hp", "exp", "item_pickup", "slow_precise", "melee_kill"],
  "disableFeatures": ["auto_run", "beat_hazard", "vertical_scroll"],
  "scoreFormula": "exp * 3 + kills * 70 + itemsCollected * 60 + distance * 0.2",
  "manualReveal": "これはダンジョン探索になりました。奥へ進んでください。",
  "theme": "rpg",
  "bgColor": "#0a0a00",
  "environment": "dungeon",
  "controls": {
    "jump": "Space",
    "moveLeft": "ArrowLeft",
    "moveRight": "ArrowRight",
    "moveUp": "ArrowUp",
    "moveDown": "ArrowDown",
    "shoot": "Z"
  },
  "gravity": 1600,
  "endingFlavor": "あなたは迷宮の奥底へたどり着いた。説明書は地図代わりになっていた。"
}
