{
  "$schema": "../../../../schemas/genre.schema.json",
  "id": "stg",
  "label": "シューティングゲーム",
  "thresholds": { "range": 5, "enemy": 5 },
  "enableFeatures": ["shoot", "three_way", "enemy_hp"],
  "disableFeatures": ["grid_stop", "puzzle_solve"],
  "scoreFormula": "kills * 120 + distance * 0.5 + combo * 80",
  "manualReveal": "これはシューティングゲームになりました。敵を倒してください。",
  "theme": "stg",
  "bgColor": "#0d0d1a",
  "environment": "space",
  "controls": {
    "jump": "Space",
    "moveLeft": "ArrowLeft",
    "moveRight": "ArrowRight",
    "moveUp": "ArrowUp",
    "moveDown": "ArrowDown",
    "shoot": "z"
  },
  "gravity": 1600,
  "endingFlavor": "あなたはすべてを撃ち抜いた。説明書は弾除けにでも使えばよかった。"
}
